{
  "schemaVersion": 3,
  "kind": "agent-authored-build-exploratory-observation",
  "observationId": "guestbook-response.kimi-k2.7.1",
  "producerVersion": "0.0.57",
  "baselineCommit": "f2768532ac970b322876c984fe93f1a61ce25c41",
  "identity": {
    "runnerId": "codex-subagent",
    "providerId": "umans",
    "modelId": "umans/umans-kimi-k2.7",
    "reasoningEffort": "high",
    "cohortId": "codex-subagents-response-v1"
  },
  "brief": {
    "id": "guestbook",
    "revision": "v2",
    "sha256": "ef4317e8eb4eccaa31417fc4f56e787a2b3dde30a6f0327154f3651dee71d925"
  },
  "semanticOracle": {
    "id": "guestbook-semantic-oracle",
    "revision": "v2",
    "sha256": "9ac9d1498edfd39f308ec052438c783a10348defe1c62a973e99140c658a9597"
  },
  "outputTransport": {
    "id": "response-artifact",
    "revision": "v1",
    "sha256": "df2a08425eeeadb4268d3b5de6d1fac8d0f76ee5840b970665c9a178a38db491"
  },
  "environment": {
    "workspaceIsolation": "prompt-restricted-not-enforced",
    "repositoryVisibility": "not-enforced",
    "networkControl": "not-enforced",
    "toolControl": "not-enforced",
    "conversationInheritance": "none-declared"
  },
  "finalState": {
    "artifactCompleted": true,
    "artifactAccepted": true,
    "semanticTestCompleted": true,
    "semanticTestsPassed": true,
    "mensorCheckCompleted": true,
    "mensorCheckPassed": true,
    "diagnosticCodes": [],
    "generatedFiles": [
      "mensor.project.jsonc",
      "package.json",
      "src/app.mjs",
      "src/features/guestbook/feature.mensor.jsonc",
      "src/features/guestbook/routes/guestbook.mjs",
      "src/features/guestbook/server/create-entry.mjs",
      "src/features/guestbook/views/index.html"
    ]
  },
  "success": true,
  "claimLevel": "exploratory-only"
}
